{
  "id": "muse-wonder-high-run-01",
  "title": "Meta: Muse Wonder / high effort",
  "model": "meta/muse-wonder",
  "provider": "OpenRouter via pi SDK",
  "status": "unverified",
  "track": "one-shot",
  "promptVersion": "1.0.0",
  "promptSha256": "cd21d5a8bb3956d82ab5650304e7e491063eacdb27dad85be6b4a845512f5e6b",
  "artifactSha256": "51f058c3acb44788c1c52886e0d61bb63459ee20a4070b36fbe56199458970b5",
  "createdAt": "2026-10-18",
  "artifact": "../artifacts/muse-wonder-high-run-01.js",
  "description": "Unreviewed one-shot SDF artifact generated at high reasoning effort.",
  "accent": "#0b6e75",
  "generationHarness": {
    "name": "pi SDK",
    "version": "0.84.3",
    "surface": "pi-coding-agent createAgentSession (in-memory, no tools)",
    "sandbox": "n/a",
    "notes": "Fresh ephemeral invocation with user config and project rules disabled; orchestrated by Codex."
  },
  "generationUsage": {
    "inputTokens": 752,
    "cachedInputTokens": 0,
    "reasoningTokens": null,
    "outputTokens": 15327,
    "totalTokens": 16079,
    "apiCostUsd": 0.30954800000000005,
    "billingMode": "api-metered",
    "source": "data/raw/muse-wonder-high-run-01/events.jsonl",
    "notes": "OpenRouter invocation via pi SDK; cost computed by pi from provider pricing (per-million-token rates)."
  },
  "validation": {
    "state": "passed",
    "checks": [
      "JavaScript syntax",
      "lifecycle contract",
      "WebGL2 compilation",
      "initial composition",
      "pointer orbit",
      "wheel zoom",
      "two-finger pinch",
      "keyboard camera",
      "multi-angle camera response",
      "close-range inspection",
      "three-trial GPU timing"
    ],
    "unmetRequirements": [],
    "warnings": []
  },
  "metrics": {
    "sourceBytes": 16172,
    "initMs": 21655.6,
    "gpuMsMedian": 6.2628,
    "gpuMsP95": 7.005,
    "throughputFps": 159.673,
    "timingMethod": "gpu-query",
    "environment": "AMD Radeon(TM) Graphics / ANGLE D3D11; Headless Chrome 155; Windows; 960x540; 3 serial trials",
    "environmentKey": "ANGLE (AMD, AMD Radeon(TM) Graphics (0x000015BF) Direct3D11 vs_5_0 ps_5_0, D3D11)|Mozilla/5.0 (Windows NT 10.0; Win64; x64) AppleWebKit/537.36 (KHTML, like Gecko) HeadlessChrome/155.0.0.0 Safari/537.36|960x540",
    "profile": "pelican-canvas-960x540-v1",
    "sampleCount": 36,
    "trials": 3,
    "measuredAt": "2026-10-18T20:28:29.976Z"
  },
  "visual": {
    "readability": null,
    "completeness": null,
    "coherence": null,
    "craft": null,
    "inspectability": null,
    "reviewers": 0
  },
  "provenance": {
    "generatorKind": "model-eval",
    "method": "Fresh one-shot pi SDK invocation; text-only with tools and skills disabled; added trailing LF",
    "rawResponse": "../raw/muse-wonder-high-run-01/response.txt",
    "decoding": "reasoning effort: high; other decoding settings not exposed"
  }
}
