{
  "id": "gpt-6-astra-medium-run-01",
  "title": "GPT-6 Astra / medium effort",
  "model": "gpt-6-astra",
  "provider": "OpenAI via Codex CLI",
  "status": "unverified",
  "track": "one-shot",
  "promptVersion": "1.0.0",
  "promptSha256": "cd21d5a8bb3956d82ab5650304e7e491063eacdb27dad85be6b4a845512f5e6b",
  "artifactSha256": "b418d95ed78e8a544b1f4902c9c39f0d4140c1c2dabbe75ec399b3d668457924",
  "createdAt": "2026-10-18",
  "artifact": "../artifacts/gpt-6-astra-medium-run-01.js",
  "description": "A rounded white and gray pelican with a long yellow throat pouch and layered wing feathers riding a turquoise bicycle, with visible crank, pedals, and a cast ground shadow.",
  "accent": "#0b6e75",
  "generationHarness": {
    "name": "Codex CLI",
    "version": "0.163.0",
    "surface": "codex exec --json",
    "sandbox": "read-only",
    "notes": "Fresh ephemeral Codex CLI invocation with user config and exec-policy rules disabled, using the default CLI system/skill context; exact canonical prompt supplied through stdin. First final response preserved without repairs. Execution policy denied attempted tool access; the denial is preserved in stderr.txt."
  },
  "generationUsage": {
    "inputTokens": 34728,
    "cachedInputTokens": 16896,
    "reasoningTokens": 1550,
    "outputTokens": 10137,
    "totalTokens": 44865,
    "apiCostUsd": 0.702066,
    "billingMode": "subscription",
    "source": "data/raw/gpt-6-astra-medium-run-01/events.jsonl",
    "notes": "Codex CLI subscription invocation; API-equivalent standard price estimated from captured tokens at OpenAI's published gpt-6-astra rates ($10/M uncached input, $1/M cached input, $50/M output); not a separate API charge."
  },
  "validation": {
    "state": "warnings",
    "checks": [
      "JavaScript syntax",
      "static module and API inspection",
      "prompt and response receipt hashes",
      "WebGL2 compilation",
      "initial composition",
      "twelve canonical views",
      "three close inspection views",
      "three serial GPU timer-query trials",
      "Pointer orbit",
      "Wheel zoom",
      "Keyboard camera",
      "Two-finger pinch",
      "Focusable canvas",
      "Fixed drawing-buffer resolution",
      "Clean WebGL rendering",
      "Context-loss handling",
      "Listener cleanup and disposal",
      "Camera frame response"
    ],
    "unmetRequirements": [],
    "warnings": [
      "Identical-view render readback differed in 18 color channels by at most 1/255; camera response was measured separately."
    ]
  },
  "metrics": {
    "sourceBytes": 22502,
    "initMs": 27595.90000000596,
    "gpuMsMedian": 2.0706800000000003,
    "gpuMsP95": 2.49356,
    "throughputFps": 482.93314273571957,
    "timingMethod": "gpu-query",
    "environment": {
      "gpu": "ANGLE (AMD, AMD Radeon(TM) Graphics (0x000015BF) Direct3D11 vs_5_0 ps_5_0, D3D11)",
      "browser": "Mozilla/5.0 (Windows NT 10.0; Win64; x64) AppleWebKit/537.36 (KHTML, like Gecko) HeadlessChrome/155.0.0.0 Safari/537.36",
      "platform": "Windows",
      "resolution": [
        960,
        540
      ]
    },
    "environmentKey": "ANGLE (AMD, AMD Radeon(TM) Graphics (0x000015BF) Direct3D11 vs_5_0 ps_5_0, D3D11)|Mozilla/5.0 (Windows NT 10.0; Win64; x64) AppleWebKit/537.36 (KHTML, like Gecko) HeadlessChrome/155.0.0.0 Safari/537.36|960x540",
    "profile": "pelican-canvas-960x540-v1",
    "sampleCount": 36,
    "trials": 3,
    "measuredAt": "2026-10-18T11:08:29.390Z"
  },
  "visual": {
    "readability": null,
    "completeness": null,
    "coherence": null,
    "craft": null,
    "inspectability": null,
    "reviewers": 0
  },
  "provenance": {
    "generatorKind": "model-eval",
    "method": "Fresh one-shot Codex CLI invocation; read-only ephemeral sandbox; added trailing LF",
    "rawResponse": "../raw/gpt-6-astra-medium-run-01/response.txt",
    "decoding": "reasoning effort: medium; other decoding settings not exposed"
  }
}
