{
  "id": "kimi-k3-low-run-01",
  "title": "MoonshotAI: Kimi K3 / low effort",
  "model": "moonshotai/kimi-k3",
  "provider": "OpenRouter via pi SDK",
  "status": "unverified",
  "track": "one-shot",
  "promptVersion": "1.0.0",
  "promptSha256": "cd21d5a8bb3956d82ab5650304e7e491063eacdb27dad85be6b4a845512f5e6b",
  "artifactSha256": "11ee01949cd3f764f36202bfe182e4637ece904acb504eb0a419a0848c7ccd94",
  "createdAt": "2026-07-18",
  "artifact": "../artifacts/kimi-k3-low-run-01.js",
  "description": "Unreviewed one-shot SDF artifact generated at low reasoning effort.",
  "accent": "#5b3fa8",
  "generationHarness": {
    "name": "pi SDK",
    "version": "0.80.10",
    "surface": "pi-coding-agent createAgentSession (in-memory, no tools)",
    "sandbox": "n/a",
    "notes": "Fresh ephemeral invocation with user config and project rules disabled; orchestrated by Codex."
  },
  "generationUsage": {
    "inputTokens": 51,
    "cachedInputTokens": 768,
    "reasoningTokens": null,
    "outputTokens": 52095,
    "totalTokens": 52914,
    "apiCostUsd": 0.7818084,
    "billingMode": "api-metered",
    "source": "data/raw/kimi-k3-low-run-01/events.jsonl",
    "notes": "OpenRouter invocation via pi SDK; cost computed by pi from provider pricing (per-million-token rates)."
  },
  "validation": {
    "state": "untested",
    "checks": [],
    "unmetRequirements": [],
    "warnings": [
      "Draft; runtime and visual validation have not run."
    ]
  },
  "metrics": {
    "sourceBytes": 12218,
    "initMs": 3373.2000000178814,
    "gpuMsMedian": 1.5060600000000002,
    "gpuMsP95": 2.0658,
    "throughputFps": 663.9841706173725,
    "timingMethod": "gpu-query",
    "environment": {
      "gpu": "ANGLE (AMD, AMD Radeon(TM) Graphics (0x000015BF) Direct3D11 vs_5_0 ps_5_0, D3D11)",
      "browser": "Mozilla/5.0 (Windows NT 10.0; Win64; x64) AppleWebKit/537.36 (KHTML, like Gecko) HeadlessChrome/150.0.0.0 Safari/537.36",
      "platform": "Windows",
      "resolution": [
        960,
        540
      ]
    },
    "environmentKey": "ANGLE (AMD, AMD Radeon(TM) Graphics (0x000015BF) Direct3D11 vs_5_0 ps_5_0, D3D11)|Mozilla/5.0 (Windows NT 10.0; Win64; x64) AppleWebKit/537.36 (KHTML, like Gecko) HeadlessChrome/150.0.0.0 Safari/537.36|960x540",
    "profile": "pelican-canvas-960x540-v1",
    "sampleCount": 36,
    "trials": 3,
    "measuredAt": "2026-07-18T16:30:42.730Z"
  },
  "visual": {
    "readability": null,
    "completeness": null,
    "coherence": null,
    "craft": null,
    "inspectability": null,
    "reviewers": 0
  },
  "provenance": {
    "generatorKind": "model-eval",
    "method": "Fresh one-shot pi SDK invocation; text-only with tools and skills disabled; added trailing LF",
    "rawResponse": "../raw/kimi-k3-low-run-01/response.txt",
    "decoding": "reasoning effort: low; other decoding settings not exposed"
  }
}
