{
  "id": "deepseek-v4-1-flash-low-run-01",
  "title": "DeepSeek: DeepSeek V4.1 Flash / low effort",
  "model": "deepseek/deepseek-v4.1-flash",
  "provider": "OpenRouter via pi SDK",
  "status": "unverified",
  "track": "one-shot",
  "promptVersion": "1.0.0",
  "promptSha256": "cd21d5a8bb3956d82ab5650304e7e491063eacdb27dad85be6b4a845512f5e6b",
  "artifactSha256": "73c773368ef576cd7f9d10cf504d9ae3a78cf268d75b394a411d8190209ec949",
  "createdAt": "2026-10-18",
  "artifact": "../artifacts/deepseek-v4-1-flash-low-run-01.js",
  "description": "Unreviewed one-shot SDF artifact generated at low reasoning effort.",
  "accent": "#1f6feb",
  "generationHarness": {
    "name": "pi SDK",
    "version": "0.84.3",
    "surface": "pi-coding-agent createAgentSession (in-memory, no tools)",
    "sandbox": "n/a",
    "notes": "Fresh ephemeral invocation with user config and project rules disabled; orchestrated by Codex."
  },
  "generationUsage": {
    "inputTokens": 777,
    "cachedInputTokens": 0,
    "reasoningTokens": null,
    "outputTokens": 47204,
    "totalTokens": 47981,
    "apiCostUsd": 0.034005341519999996,
    "billingMode": "api-metered",
    "source": "data/raw/deepseek-v4-1-flash-low-run-01/events.jsonl",
    "notes": "OpenRouter invocation via pi SDK; cost computed by pi from provider pricing (per-million-token rates)."
  },
  "validation": {
    "state": "passed",
    "checks": [
      "JavaScript syntax",
      "lifecycle contract",
      "WebGL2 compilation",
      "initial composition",
      "pointer orbit",
      "wheel zoom",
      "two-finger pinch",
      "keyboard camera",
      "multi-angle camera response",
      "close-range inspection",
      "three-trial GPU timing"
    ],
    "unmetRequirements": [],
    "warnings": []
  },
  "metrics": {
    "sourceBytes": 15279,
    "initMs": 4535.8,
    "gpuMsMedian": 8.3843,
    "gpuMsP95": 9.4279,
    "throughputFps": 119.27,
    "timingMethod": "gpu-query",
    "environment": "AMD Radeon(TM) Graphics / ANGLE D3D11; Headless Chrome 155; Windows; 960x540; 3 serial trials",
    "environmentKey": "ANGLE (AMD, AMD Radeon(TM) Graphics (0x000015BF) Direct3D11 vs_5_0 ps_5_0, D3D11)|Mozilla/5.0 (Windows NT 10.0; Win64; x64) AppleWebKit/537.36 (KHTML, like Gecko) HeadlessChrome/155.0.0.0 Safari/537.36|960x540",
    "profile": "pelican-canvas-960x540-v1",
    "sampleCount": 36,
    "trials": 3,
    "measuredAt": "2026-10-18T20:27:27.196Z"
  },
  "visual": {
    "readability": null,
    "completeness": null,
    "coherence": null,
    "craft": null,
    "inspectability": null,
    "reviewers": 0
  },
  "provenance": {
    "generatorKind": "model-eval",
    "method": "Fresh one-shot pi SDK invocation; text-only with tools and skills disabled; removed one surrounding Markdown fence; added trailing LF",
    "rawResponse": "../raw/deepseek-v4-1-flash-low-run-01/response.txt",
    "decoding": "reasoning effort: low; other decoding settings not exposed"
  }
}
