{
  "id": "claude-haiku-4-5-xhigh-run-01",
  "title": "Claude Haiku 4.5 / xhigh effort",
  "model": "claude-haiku-4-5-20251001",
  "provider": "Anthropic via Claude Code CLI",
  "status": "unverified",
  "track": "one-shot",
  "promptVersion": "1.0.0",
  "promptSha256": "cd21d5a8bb3956d82ab5650304e7e491063eacdb27dad85be6b4a845512f5e6b",
  "artifactSha256": "95e12ef8fb6fc64fee9ebc64cf91d1345009ec8f258db8a9d2f3a81939762f78",
  "createdAt": "2026-07-18",
  "artifact": "../artifacts/claude-haiku-4-5-xhigh-run-01.js",
  "description": "Opening and close-inspection views render near-empty; from raised side angles a small gold bird sits astride two large intersecting rings with stick cranks.",
  "accent": "#4f8fb0",
  "generationHarness": {
    "name": "Claude Code CLI",
    "version": "2.1.214 (Claude Code)",
    "surface": "claude -p --tools \"\" --setting-sources \"\" --strict-mcp-config --system-prompt <minimal> --output-format json (prompt piped byte-exact via stdin)",
    "sandbox": "n/a (no tools available)",
    "notes": "Fresh non-interactive invocation with a minimal replacement system prompt; no tools, skills, hooks, MCP servers, CLAUDE.md, or memory in context (verified 253-token bare context probe)."
  },
  "generationUsage": {
    "inputTokens": 952,
    "cachedInputTokens": 0,
    "reasoningTokens": null,
    "outputTokens": 21466,
    "totalTokens": 22418,
    "apiCostUsd": 0.10967299999999999,
    "billingMode": "subscription",
    "source": "data/raw/claude-haiku-4-5-xhigh-run-01/events.jsonl",
    "notes": "Claude subscription invocation; total_cost_usd is the CLI's pricing estimate, not a separate API charge."
  },
  "validation": {
    "state": "passed",
    "checks": [
      "JavaScript syntax",
      "lifecycle contract",
      "WebGL2 compilation",
      "initial composition",
      "pointer orbit",
      "wheel zoom",
      "two-finger pinch",
      "keyboard camera",
      "multi-angle camera response",
      "close-range inspection",
      "three-trial GPU timing"
    ],
    "unmetRequirements": [],
    "warnings": [
      "Initial and close-inspection views render near-empty; the subject is only visible from raised and side angles."
    ]
  },
  "metrics": {
    "sourceBytes": 7384,
    "initMs": 631.6,
    "gpuMsMedian": 1.123,
    "gpuMsP95": 1.2807,
    "throughputFps": 890.4561,
    "timingMethod": "gpu-query",
    "environment": "AMD Radeon(TM) Graphics / ANGLE D3D11; Headless Chrome 150; Windows; 960x540; 3 serial trials",
    "environmentKey": "amd-15bf-angle-d3d11|headless-chrome-150|windows|960x540|pelican-canvas-v1",
    "profile": "pelican-canvas-960x540-v1",
    "sampleCount": 36,
    "trials": 3,
    "measuredAt": "2026-07-18T11:53:16.524Z"
  },
  "visual": {
    "readability": null,
    "completeness": null,
    "coherence": null,
    "craft": null,
    "inspectability": null,
    "reviewers": 0
  },
  "provenance": {
    "generatorKind": "model-eval",
    "method": "Fresh one-shot Claude Code CLI invocation; text-only with tools and skills disabled; removed one surrounding Markdown fence; added trailing LF",
    "rawResponse": "../raw/claude-haiku-4-5-xhigh-run-01/response.txt",
    "decoding": "reasoning effort: xhigh; other decoding settings not exposed"
  }
}
