{
  "id": "claude-fable-5-max-run-01",
  "title": "Claude Fable 5 / max effort",
  "model": "claude-fable-5",
  "provider": "Anthropic via Claude Code CLI",
  "status": "unverified",
  "track": "one-shot",
  "promptVersion": "1.0.0",
  "promptSha256": "cd21d5a8bb3956d82ab5650304e7e491063eacdb27dad85be6b4a845512f5e6b",
  "artifactSha256": "b5133ba5698a286e90c19a8ba3edf09f7287f13222f76387f49df4432a7f1e5a",
  "createdAt": "2026-07-18",
  "artifact": "../artifacts/claude-fable-5-max-run-01.js",
  "description": "A pelican with a full cream pouch pedals a teal fat-tire bicycle along a marked roadway with dashed lane lines fading into a hazy sky.",
  "accent": "#7b4fa6",
  "generationHarness": {
    "name": "Claude Code CLI",
    "version": "2.1.214 (Claude Code)",
    "surface": "claude -p --tools \"\" --setting-sources \"\" --strict-mcp-config --system-prompt <minimal> --output-format json (prompt piped byte-exact via stdin); CLAUDE_CODE_MAX_OUTPUT_TOKENS=128000",
    "sandbox": "n/a (no tools available)",
    "notes": "Fresh non-interactive invocation with a minimal replacement system prompt; no tools, skills, hooks, MCP servers, CLAUDE.md, or memory in context (verified 253-token bare context probe)."
  },
  "generationUsage": {
    "inputTokens": 1,
    "cachedInputTokens": 0,
    "reasoningTokens": null,
    "outputTokens": 62098,
    "totalTokens": 63657,
    "apiCostUsd": 3.137461,
    "billingMode": "subscription",
    "source": "data/raw/claude-fable-5-max-run-01/events.jsonl",
    "notes": "Claude subscription invocation; total_cost_usd is the CLI's pricing estimate, not a separate API charge."
  },
  "validation": {
    "state": "passed",
    "checks": [
      "JavaScript syntax",
      "lifecycle contract",
      "WebGL2 compilation",
      "initial composition",
      "pointer orbit",
      "wheel zoom",
      "two-finger pinch",
      "keyboard camera",
      "multi-angle camera response",
      "close-range inspection",
      "three-trial GPU timing"
    ],
    "unmetRequirements": [],
    "warnings": []
  },
  "metrics": {
    "sourceBytes": 13811,
    "initMs": 3649.2,
    "gpuMsMedian": 3.5743,
    "gpuMsP95": 4.1847,
    "throughputFps": 279.7766,
    "timingMethod": "gpu-query",
    "environment": "AMD Radeon(TM) Graphics / ANGLE D3D11; Headless Chrome 150; Windows; 960x540; 3 serial trials",
    "environmentKey": "amd-15bf-angle-d3d11|headless-chrome-150|windows|960x540|pelican-canvas-v1",
    "profile": "pelican-canvas-960x540-v1",
    "sampleCount": 36,
    "trials": 3,
    "measuredAt": "2026-07-18T13:12:27.515Z"
  },
  "visual": {
    "readability": null,
    "completeness": null,
    "coherence": null,
    "craft": null,
    "inspectability": null,
    "reviewers": 0
  },
  "provenance": {
    "generatorKind": "model-eval",
    "method": "Fresh one-shot Claude Code CLI invocation; text-only with tools and skills disabled; added trailing LF",
    "rawResponse": "../raw/claude-fable-5-max-run-01/response.txt",
    "decoding": "reasoning effort: max; other decoding settings not exposed"
  }
}
