{
  "id": "gpt-5-6-luna-high-run-01",
  "title": "Luna / high effort",
  "model": "gpt-5.6-luna",
  "provider": "OpenAI via Codex CLI",
  "status": "unverified",
  "track": "one-shot",
  "promptVersion": "1.0.0",
  "promptSha256": "cd21d5a8bb3956d82ab5650304e7e491063eacdb27dad85be6b4a845512f5e6b",
  "artifactSha256": "33939c4b755d8812c9232182391bc7161269ecadc48c06a5b54e83da6e8f0c1f",
  "createdAt": "2026-07-18",
  "artifact": "../artifacts/gpt-5-6-luna-high-run-01.js",
  "description": "A detailed monochrome SDF with spoked wheels, complete frame and rider contacts, long beak and pouch, checker ground, and subdued directional lighting.",
  "accent": "#446aa8",
  "generationHarness": {
    "name": "Codex CLI",
    "version": "0.144.5",
    "surface": "codex exec --json",
    "sandbox": "read-only",
    "notes": "Fresh ephemeral invocation with user config and project rules disabled; orchestrated by Codex."
  },
  "generationUsage": {
    "inputTokens": 11440,
    "cachedInputTokens": 8960,
    "reasoningTokens": null,
    "outputTokens": 11179,
    "totalTokens": 22619,
    "apiCostUsd": null,
    "billingMode": "subscription",
    "source": "data/raw/gpt-5-6-luna-high-run-01/events.jsonl",
    "notes": "Codex CLI subscription invocation; no per-call API charge was exposed."
  },
  "validation": {
    "state": "passed",
    "checks": [
      "JavaScript syntax",
      "lifecycle contract",
      "WebGL2 compilation",
      "initial composition",
      "pointer orbit",
      "wheel zoom",
      "two-finger pinch",
      "keyboard camera",
      "multi-angle camera response",
      "close-range inspection",
      "three-trial GPU timing"
    ],
    "unmetRequirements": [],
    "warnings": []
  },
  "metrics": {
    "sourceBytes": 11572,
    "initMs": 2708.1,
    "gpuMsMedian": 3.71742,
    "gpuMsP95": 4.00188,
    "throughputFps": 269.0038,
    "timingMethod": "gpu-query",
    "environment": "AMD Radeon(TM) Graphics / ANGLE D3D11; Headless Chrome 150; Windows; 960x540; 3 serial trials",
    "environmentKey": "amd-15bf-angle-d3d11|headless-chrome-150|windows|960x540|pelican-canvas-v1",
    "profile": "pelican-canvas-960x540-v1",
    "sampleCount": 36,
    "trials": 3,
    "measuredAt": "2026-07-18T11:09:56.412Z"
  },
  "visual": {
    "readability": null,
    "completeness": null,
    "coherence": null,
    "craft": null,
    "inspectability": null,
    "reviewers": 0
  },
  "provenance": {
    "generatorKind": "model-eval",
    "method": "Fresh one-shot Codex CLI invocation; read-only ephemeral sandbox; no repair turn; only normalization was adding a trailing LF",
    "rawResponse": "../raw/gpt-5-6-luna-high-run-01/response.txt",
    "decoding": "reasoning effort: high; other decoding settings not exposed"
  }
}
