{
  "id": "gpt-6-1-sol-xhigh-run-01",
  "title": "GPT-6.1 Sol / xhigh effort",
  "model": "gpt-6.1-sol",
  "provider": "OpenAI via Codex CLI",
  "status": "unverified",
  "track": "one-shot",
  "promptVersion": "1.0.0",
  "promptSha256": "cd21d5a8bb3956d82ab5650304e7e491063eacdb27dad85be6b4a845512f5e6b",
  "artifactSha256": "07024a15ca2c34e75659e752675a884329e412eab7ef970d92902c974c48c315",
  "createdAt": "2026-10-18",
  "artifact": "../artifacts/gpt-6-1-sol-xhigh-run-01.js",
  "description": "A white pelican with blue-gray folded wing feathers and a long yellow bill and orange throat pouch riding a teal bicycle with cream tires, fenders, a front lamp, and a gold-colored chain drive.",
  "accent": "#c94f2d",
  "generationHarness": {
    "name": "Codex CLI",
    "version": "0.163.0",
    "surface": "codex exec --json",
    "sandbox": "read-only",
    "notes": "Fresh ephemeral Codex CLI invocation with user config and exec-policy rules disabled, using the default CLI system/skill context; exact canonical prompt supplied through stdin. First final response preserved without repairs. Execution policy denied attempted tool access; the denial is preserved in stderr.txt."
  },
  "generationUsage": {
    "inputTokens": 167528,
    "cachedInputTokens": 113152,
    "reasoningTokens": 22669,
    "outputTokens": 45279,
    "totalTokens": 212807,
    "apiCostUsd": 0.5728572,
    "billingMode": "subscription",
    "source": "data/raw/gpt-6-1-sol-xhigh-run-01/events.jsonl",
    "notes": "Codex CLI subscription invocation; API-equivalent standard price estimated from captured tokens at OpenAI's published gpt-6.1-sol rates ($2/M uncached input, $0.1/M cached input, $10/M output); not a separate API charge."
  },
  "validation": {
    "state": "passed",
    "checks": [
      "JavaScript syntax",
      "static module and API inspection",
      "prompt and response receipt hashes",
      "WebGL2 compilation",
      "initial composition",
      "twelve canonical views",
      "three close inspection views",
      "three serial GPU timer-query trials",
      "Pointer orbit",
      "Wheel zoom",
      "Keyboard camera",
      "Two-finger pinch",
      "Focusable canvas",
      "Fixed drawing-buffer resolution",
      "Clean WebGL rendering",
      "Context-loss handling",
      "Listener cleanup and disposal",
      "Deterministic repeated-frame readback",
      "Camera frame response"
    ],
    "unmetRequirements": [],
    "warnings": []
  },
  "metrics": {
    "sourceBytes": 26300,
    "initMs": 10677.39999999851,
    "gpuMsMedian": 1.18696,
    "gpuMsP95": 1.41296,
    "throughputFps": 842.4883736604435,
    "timingMethod": "gpu-query",
    "environment": {
      "gpu": "ANGLE (AMD, AMD Radeon(TM) Graphics (0x000015BF) Direct3D11 vs_5_0 ps_5_0, D3D11)",
      "browser": "Mozilla/5.0 (Windows NT 10.0; Win64; x64) AppleWebKit/537.36 (KHTML, like Gecko) HeadlessChrome/155.0.0.0 Safari/537.36",
      "platform": "Windows",
      "resolution": [
        960,
        540
      ]
    },
    "environmentKey": "ANGLE (AMD, AMD Radeon(TM) Graphics (0x000015BF) Direct3D11 vs_5_0 ps_5_0, D3D11)|Mozilla/5.0 (Windows NT 10.0; Win64; x64) AppleWebKit/537.36 (KHTML, like Gecko) HeadlessChrome/155.0.0.0 Safari/537.36|960x540",
    "profile": "pelican-canvas-960x540-v1",
    "sampleCount": 36,
    "trials": 3,
    "measuredAt": "2026-10-18T12:04:23.178Z"
  },
  "visual": {
    "readability": null,
    "completeness": null,
    "coherence": null,
    "craft": null,
    "inspectability": null,
    "reviewers": 0
  },
  "provenance": {
    "generatorKind": "model-eval",
    "method": "Fresh one-shot Codex CLI invocation; read-only ephemeral sandbox; added trailing LF",
    "rawResponse": "../raw/gpt-6-1-sol-xhigh-run-01/response.txt",
    "decoding": "reasoning effort: xhigh; other decoding settings not exposed"
  }
}
