{
  "id": "deepseek-v4-flash-off-run-01",
  "title": "DeepSeek: DeepSeek V4 Flash / off effort",
  "model": "deepseek/deepseek-v4-flash",
  "provider": "OpenRouter via pi SDK",
  "status": "unverified",
  "track": "one-shot",
  "promptVersion": "1.0.0",
  "promptSha256": "cd21d5a8bb3956d82ab5650304e7e491063eacdb27dad85be6b4a845512f5e6b",
  "artifactSha256": "f20cd288864ffdff0ecf62789585ff2c28f46db775d733ffbe1a1dd1f13364d1",
  "createdAt": "2026-07-18",
  "artifact": "../artifacts/deepseek-v4-flash-off-run-01.js",
  "description": "Unreviewed one-shot SDF artifact generated at off reasoning effort.",
  "accent": "#1f6feb",
  "generationHarness": {
    "name": "pi SDK",
    "version": "0.80.10",
    "surface": "pi-coding-agent createAgentSession (in-memory, no tools)",
    "sandbox": "n/a",
    "notes": "Fresh ephemeral invocation with user config and project rules disabled; orchestrated by Codex."
  },
  "generationUsage": {
    "inputTokens": 750,
    "cachedInputTokens": 0,
    "reasoningTokens": null,
    "outputTokens": 4643,
    "totalTokens": 5393,
    "apiCostUsd": 0.000983528,
    "billingMode": "api-metered",
    "source": "data/raw/deepseek-v4-flash-off-run-01/events.jsonl",
    "notes": "OpenRouter invocation via pi SDK; cost computed by pi from provider pricing (per-million-token rates)."
  },
  "validation": {
    "state": "untested",
    "checks": [],
    "unmetRequirements": [],
    "warnings": [
      "Draft; runtime and visual validation have not run."
    ]
  },
  "metrics": {
    "sourceBytes": 12572,
    "initMs": 406.59999999403954,
    "gpuMsMedian": 1.61152,
    "gpuMsP95": 2.71078,
    "throughputFps": 620.5321683876092,
    "timingMethod": "gpu-query",
    "environment": {
      "gpu": "ANGLE (AMD, AMD Radeon(TM) Graphics (0x000015BF) Direct3D11 vs_5_0 ps_5_0, D3D11)",
      "browser": "Mozilla/5.0 (Windows NT 10.0; Win64; x64) AppleWebKit/537.36 (KHTML, like Gecko) HeadlessChrome/150.0.0.0 Safari/537.36",
      "platform": "Windows",
      "resolution": [
        960,
        540
      ]
    },
    "environmentKey": "ANGLE (AMD, AMD Radeon(TM) Graphics (0x000015BF) Direct3D11 vs_5_0 ps_5_0, D3D11)|Mozilla/5.0 (Windows NT 10.0; Win64; x64) AppleWebKit/537.36 (KHTML, like Gecko) HeadlessChrome/150.0.0.0 Safari/537.36|960x540",
    "profile": "pelican-canvas-960x540-v1",
    "sampleCount": 36,
    "trials": 3,
    "measuredAt": "2026-07-18T16:30:37.219Z"
  },
  "visual": {
    "readability": null,
    "completeness": null,
    "coherence": null,
    "craft": null,
    "inspectability": null,
    "reviewers": 0
  },
  "provenance": {
    "generatorKind": "model-eval",
    "method": "Fresh one-shot pi SDK invocation; text-only with tools and skills disabled; removed one surrounding Markdown fence; added trailing LF",
    "rawResponse": "../raw/deepseek-v4-flash-off-run-01/response.txt",
    "decoding": "reasoning effort: off; other decoding settings not exposed"
  }
}
