{
  "id": "gemini-3-5-flash-high-run-01",
  "title": "Google: Gemini 3.5 Flash / high effort",
  "model": "google/gemini-3.5-flash",
  "provider": "OpenRouter via pi SDK",
  "status": "unverified",
  "track": "one-shot",
  "promptVersion": "1.0.0",
  "promptSha256": "cd21d5a8bb3956d82ab5650304e7e491063eacdb27dad85be6b4a845512f5e6b",
  "artifactSha256": "e001991a8a48bcc4e5b193d09e3834fb4954460395497b59d79e28dc6896fb5b",
  "createdAt": "2026-07-18",
  "artifact": "../artifacts/gemini-3-5-flash-high-run-01.js",
  "description": "Unreviewed one-shot SDF artifact generated at high reasoning effort.",
  "accent": "#0b6e75",
  "generationHarness": {
    "name": "pi SDK",
    "version": "0.80.10",
    "surface": "pi-coding-agent createAgentSession (in-memory, no tools)",
    "sandbox": "n/a",
    "notes": "Fresh ephemeral invocation with user config and project rules disabled; orchestrated by Codex."
  },
  "generationUsage": {
    "inputTokens": 757,
    "cachedInputTokens": 0,
    "reasoningTokens": null,
    "outputTokens": 39929,
    "totalTokens": 40686,
    "apiCostUsd": 0.3604965,
    "billingMode": "api-metered",
    "source": "data/raw/gemini-3-5-flash-high-run-01/events.jsonl",
    "notes": "OpenRouter invocation via pi SDK; cost computed by pi from provider pricing (per-million-token rates)."
  },
  "validation": {
    "state": "untested",
    "checks": [],
    "unmetRequirements": [],
    "warnings": [
      "Draft; runtime and visual validation have not run."
    ]
  },
  "metrics": {
    "sourceBytes": 22044,
    "initMs": 2606.0999999940395,
    "gpuMsMedian": 4.7794799999999995,
    "gpuMsP95": 5.47296,
    "throughputFps": 209.22778210181863,
    "timingMethod": "gpu-query",
    "environment": {
      "gpu": "ANGLE (AMD, AMD Radeon(TM) Graphics (0x000015BF) Direct3D11 vs_5_0 ps_5_0, D3D11)",
      "browser": "Mozilla/5.0 (Windows NT 10.0; Win64; x64) AppleWebKit/537.36 (KHTML, like Gecko) HeadlessChrome/150.0.0.0 Safari/537.36",
      "platform": "Windows",
      "resolution": [
        960,
        540
      ]
    },
    "environmentKey": "ANGLE (AMD, AMD Radeon(TM) Graphics (0x000015BF) Direct3D11 vs_5_0 ps_5_0, D3D11)|Mozilla/5.0 (Windows NT 10.0; Win64; x64) AppleWebKit/537.36 (KHTML, like Gecko) HeadlessChrome/150.0.0.0 Safari/537.36|960x540",
    "profile": "pelican-canvas-960x540-v1",
    "sampleCount": 36,
    "trials": 3,
    "measuredAt": "2026-07-18T16:51:04.477Z"
  },
  "visual": {
    "readability": null,
    "completeness": null,
    "coherence": null,
    "craft": null,
    "inspectability": null,
    "reviewers": 0
  },
  "provenance": {
    "generatorKind": "model-eval",
    "method": "Fresh one-shot pi SDK invocation; text-only with tools and skills disabled; added trailing LF",
    "rawResponse": "../raw/gemini-3-5-flash-high-run-01/response.txt",
    "decoding": "reasoning effort: high; other decoding settings not exposed"
  }
}
